{
  "schema_version": "1.0.0",
  "session_id": "m1p0-sim-normal-001",
  "window_id": "window-0001",
  "start_device_time_us": 1000000,
  "end_device_time_us": 4000000,
  "label": "acceptable",
  "score": 0.91,
  "confidence": null,
  "reason_codes": [],
  "metrics": {
    "valid_fraction": 0.98,
    "clipping_fraction": 0.0,
    "baseline_drift_raw": 12.5,
    "pulse_std_raw": 420.0,
    "beat_count": 8,
    "ppg_match_rate": 0.875
  },
  "valid_duration_s": 30.0,
  "processing_version": "s1-pre-0.0.0",
  "parameter_version": "quality-params-pending-h1",
  "parameter_status": "pending_h1_calibration"
}
